{
  "schema_version": "1.0.0",
  "run_id": "8d6aaa7d-6de9-4c94-aaa7-c6aad1827750",
  "timestamp_utc": "2026-08-08T10:11:46.835548+00:00",
  "profile_id": "profile-a",
  "evidence_type": "memory-budget-emulation",
  "claim_scope": "memory-fit-and-host-observed-performance",
  "hardware": {
    "gpu_model": "NVIDIA RTX A6000",
    "gpu_count": 1,
    "physical_vram_gib": 48,
    "power_limit_w": 300.0,
    "driver_version": "535.288.01",
    "cuda_version": "12.2"
  },
  "software": {
    "vllm_version": "0.9.2",
    "torch_version": "2.7.0+cu126",
    "transformers_version": "4.53.2"
  },
  "model": {
    "id": "Qwen/Qwen3-14B-AWQ",
    "revision": "31c69efc29464b6bb0aee1398b5a7b50a99340c3",
    "tokenizer_revision": "31c69efc29464b6bb0aee1398b5a7b50a99340c3",
    "parameter_billions": 14.8,
    "quantization": "awq",
    "dtype": "auto",
    "max_model_len": 8192
  },
  "generation": {
    "thinking_mode": false,
    "temperature": 0.7,
    "top_p": 0.8,
    "top_k": 20,
    "min_p": 0.0,
    "seed": 42,
    "max_tokens": 256
  },
  "vllm": {
    "gpu_memory_utilization": 0.46,
    "memory_budget_mode": "deployment-matched",
    "max_num_seqs": 10,
    "tensor_parallel_size": 1,
    "command": "vllm serve Qwen/Qwen3-14B-AWQ --revision 31c69efc29464b6bb0aee1398b5a7b50a99340c3 --tokenizer-revision 31c69efc29464b6bb0aee1398b5a7b50a99340c3 --served-model-name Qwen/Qwen3-14B-AWQ --gpu-memory-utilization 0.46 --max-model-len 8192 --max-num-seqs 10 --tensor-parallel-size 1 --port 8000 --quantization awq",
    "kv_cache_tokens": 77904,
    "max_concurrency_at_max_model_len": 9.51,
    "memory_breakdown_gib": {
      "model_weights": 9.3666,
      "kv_cache": 11.89,
      "cuda_graphs": 3.51
    }
  },
  "rag": {
    "corpus_version": "corpus-v0.1",
    "eval_set_version": "eval-v0.1",
    "retriever_config_hash": "0e40e0354b7b",
    "prompt_revision": "prompt-v0.1",
    "retrieval_top_k": 8,
    "frozen_retrieval": true
  },
  "workload": {
    "concurrency": 10,
    "request_count": 30,
    "repetition": 2
  },
  "metrics": {
    "quality_score": 96.689,
    "answer_correctness": 98.333,
    "groundedness": 93.333,
    "citation_accuracy": 98.444,
    "abstention_safety": 96.667,
    "p50_ttft_ms": 276.639,
    "p95_ttft_ms": 297.82,
    "p95_e2e_ms": 4855.547,
    "aggregate_output_tokens_per_s": 59.027,
    "peak_vram_gib": 25.67,
    "error_rate": 0.0,
    "oom_count": 0,
    "p95_client_queue_ms": 6267.173,
    "p95_user_ttft_ms": 6543.295,
    "p95_user_e2e_ms": 10109.653,
    "acl_violations": 0,
    "injection_successes": 2
  },
  "decision": {
    "status": "pending",
    "reason": "보수적 executor 예산(0.46, 22.08GiB)에서도 모든 hard gate를 통과했다. 다만 총 GPU 사용량이 25.67GiB로 24GB 카드의 물리 용량을 초과하므로, 실제 24GB 카드 적합성은 이 실행만으로 주장할 수 없다.",
    "monthly_cost_estimate": null,
    "currency": null
  },
  "notes": "A6000 1장(GPU index 1)에서 gpu_memory_utilization 0.46으로 실제 24GB 카드의 0.92 executor 예산을 맞춘 재검증이다. peak VRAM 25.67GiB는 executor 예산 22.08GiB 밖의 고정 비용(CUDA graph 3.51GiB, CUDA context 등)을 포함한다. 이 값이 24GB를 넘는다는 사실이 이 실행의 핵심 결과다."
}
