{
  "schema_version": "1.0.0",
  "run_id": "fc7dac8e-8dd8-48c1-89a2-2f142336213c",
  "timestamp_utc": "2026-08-08T10:11:19.032306+00:00",
  "profile_id": "profile-a",
  "evidence_type": "memory-budget-emulation",
  "claim_scope": "memory-fit-and-host-observed-performance",
  "hardware": {
    "gpu_model": "NVIDIA RTX A6000",
    "gpu_count": 1,
    "physical_vram_gib": 48,
    "power_limit_w": 300.0,
    "driver_version": "535.288.01",
    "cuda_version": "12.2"
  },
  "software": {
    "vllm_version": "0.9.2",
    "torch_version": "2.7.0+cu126",
    "transformers_version": "4.53.2"
  },
  "model": {
    "id": "Qwen/Qwen3-14B-AWQ",
    "revision": "31c69efc29464b6bb0aee1398b5a7b50a99340c3",
    "tokenizer_revision": "31c69efc29464b6bb0aee1398b5a7b50a99340c3",
    "parameter_billions": 14.8,
    "quantization": "awq",
    "dtype": "auto",
    "max_model_len": 8192
  },
  "generation": {
    "thinking_mode": false,
    "temperature": 0.7,
    "top_p": 0.8,
    "top_k": 20,
    "min_p": 0.0,
    "seed": 42,
    "max_tokens": 256
  },
  "vllm": {
    "gpu_memory_utilization": 0.5,
    "memory_budget_mode": "class-ceiling",
    "max_num_seqs": 10,
    "tensor_parallel_size": 1,
    "command": "vllm serve Qwen/Qwen3-14B-AWQ --revision 31c69efc29464b6bb0aee1398b5a7b50a99340c3 --tokenizer-revision 31c69efc29464b6bb0aee1398b5a7b50a99340c3 --served-model-name Qwen/Qwen3-14B-AWQ --gpu-memory-utilization 0.50 --max-model-len 8192 --max-num-seqs 10 --tensor-parallel-size 1 --port 8000 --quantization awq",
    "kv_cache_tokens": 90352,
    "max_concurrency_at_max_model_len": 11.03,
    "memory_breakdown_gib": {
      "model_weights": 9.3666,
      "kv_cache": 13.79,
      "cuda_graphs": 3.51
    }
  },
  "rag": {
    "corpus_version": "corpus-v0.1",
    "eval_set_version": "eval-v0.1",
    "retriever_config_hash": "0e40e0354b7b",
    "prompt_revision": "prompt-v0.1",
    "retrieval_top_k": 8,
    "frozen_retrieval": true
  },
  "workload": {
    "concurrency": 10,
    "request_count": 30,
    "repetition": 2
  },
  "metrics": {
    "quality_score": 96.689,
    "answer_correctness": 98.333,
    "groundedness": 93.333,
    "citation_accuracy": 98.444,
    "abstention_safety": 96.667,
    "p50_ttft_ms": 288.591,
    "p95_ttft_ms": 303.862,
    "p95_e2e_ms": 5052.753,
    "aggregate_output_tokens_per_s": 55.986,
    "peak_vram_gib": 27.547,
    "error_rate": 0.0,
    "oom_count": 0,
    "p95_client_queue_ms": 6589.593,
    "p95_user_ttft_ms": 6878.418,
    "p95_user_e2e_ms": 10524.517,
    "acl_violations": 0,
    "injection_successes": 2
  },
  "decision": {
    "status": "pending",
    "reason": "모든 hard gate 통과. 품질 전 축에서 8B보다 우위이고 최대 동시성 11.03으로 요구치를 만족하나, 집계 처리량이 8B의 약 1/5이다.",
    "monthly_cost_estimate": null,
    "currency": null
  },
  "notes": "A6000 1장(GPU index 1)에서 gpu_memory_utilization 0.50으로 24GB class 명목 상한을 흉내낸 실행이다. retrieval은 8B와 동일한 동결 결과를 사용해 generation-only 비교를 만들었다. 지연시간과 처리량은 A6000 관측값이다."
}
