{
  "schema_version": "1.0.0",
  "run_id": "3e0b6c61-fa20-48f5-9c46-dd5c80ba144a",
  "timestamp_utc": "2026-08-08T13:21:20.412042+00:00",
  "profile_id": "profile-a",
  "evidence_type": "memory-budget-emulation",
  "claim_scope": "memory-fit-and-host-observed-performance",
  "hardware": {
    "gpu_model": "NVIDIA RTX A6000",
    "gpu_count": 1,
    "physical_vram_gib": 48,
    "power_limit_w": 300.0,
    "driver_version": "535.288.01",
    "cuda_version": "12.2"
  },
  "software": {
    "vllm_version": "0.9.2",
    "torch_version": "2.7.0+cu126",
    "transformers_version": "4.53.2"
  },
  "model": {
    "id": "Qwen/Qwen3-8B",
    "revision": "b968826d9c46dd6066d109eabc6255188de91218",
    "tokenizer_revision": "b968826d9c46dd6066d109eabc6255188de91218",
    "parameter_billions": 8.2,
    "quantization": "none",
    "dtype": "auto",
    "max_model_len": 8192
  },
  "generation": {
    "thinking_mode": false,
    "temperature": 0.7,
    "top_p": 0.8,
    "top_k": 20,
    "min_p": 0.0,
    "seed": 42,
    "max_tokens": 256
  },
  "vllm": {
    "gpu_memory_utilization": 0.5,
    "memory_budget_mode": "class-ceiling",
    "max_num_seqs": 10,
    "tensor_parallel_size": 1,
    "command": "vllm serve Qwen/Qwen3-8B --revision b968826d9c46dd6066d109eabc6255188de91218 --tokenizer-revision b968826d9c46dd6066d109eabc6255188de91218 --served-model-name Qwen/Qwen3-8B --gpu-memory-utilization 0.50 --max-model-len 8192 --max-num-seqs 10 --tensor-parallel-size 1 --port 8000 --enforce-eager",
    "enforce_eager": true,
    "kv_cache_tokens": 59920,
    "max_concurrency_at_max_model_len": 7.31,
    "memory_breakdown_gib": {
      "model_weights": 15.2683,
      "kv_cache": 8.23,
      "cuda_graphs": null
    }
  },
  "rag": {
    "corpus_version": "corpus-v0.1",
    "eval_set_version": "eval-v0.1",
    "retriever_config_hash": "11d1f8cfeb42",
    "prompt_revision": "prompt-v0.1",
    "retrieval_top_k": 8,
    "frozen_retrieval": false
  },
  "workload": {
    "concurrency": 10,
    "request_count": 30,
    "repetition": 1
  },
  "metrics": {
    "quality_score": 95.926,
    "answer_correctness": 97.5,
    "groundedness": 93.333,
    "citation_accuracy": 96.296,
    "abstention_safety": 96.667,
    "p50_ttft_ms": 56.045,
    "p95_ttft_ms": 80.732,
    "p95_e2e_ms": 994.515,
    "aggregate_output_tokens_per_s": 285.562,
    "peak_vram_gib": 24.006,
    "error_rate": 0.0,
    "oom_count": 0,
    "p95_client_queue_ms": 1291.905,
    "p95_user_ttft_ms": 1347.222,
    "p95_user_e2e_ms": 2034.926,
    "acl_violations": 0,
    "injection_successes": 2
  },
  "decision": {
    "status": "pending",
    "reason": "CUDA graph 없이 측정. 모든 hard gate 통과하나 peak VRAM 24.01GiB로 24GB 카드 물리 용량을 근소하게 초과한다. 품질 95.9로 14B AWQ(97.7)보다 낮고, 최대 동시성 7.31로 요구치 10에 미달한다. graph를 끈 조건에서는 14B AWQ 대비 우위가 없다.",
    "monthly_cost_estimate": null,
    "currency": null
  },
  "notes": "A6000 1장(GPU index 1)에서 class-ceiling 예산으로 측정. 지연시간과 처리량은 A6000 관측값이며 대상 카드 성능이 아니다."
}
