{
  "schema_version": "1.0.0",
  "run_id": "93d606b7-40cb-4760-b892-897e4b946839",
  "timestamp_utc": "2026-08-08T13:24:29.302803+00:00",
  "profile_id": "profile-a",
  "evidence_type": "memory-budget-emulation",
  "claim_scope": "memory-fit-and-host-observed-performance",
  "hardware": {
    "gpu_model": "NVIDIA RTX A6000",
    "gpu_count": 1,
    "physical_vram_gib": 48,
    "power_limit_w": 300.0,
    "driver_version": "535.288.01",
    "cuda_version": "12.2"
  },
  "software": {
    "vllm_version": "0.9.2",
    "torch_version": "2.7.0+cu126",
    "transformers_version": "4.53.2"
  },
  "model": {
    "id": "Qwen/Qwen3-14B-AWQ",
    "revision": "31c69efc29464b6bb0aee1398b5a7b50a99340c3",
    "tokenizer_revision": "31c69efc29464b6bb0aee1398b5a7b50a99340c3",
    "parameter_billions": 14.8,
    "quantization": "awq",
    "dtype": "auto",
    "max_model_len": 8192
  },
  "generation": {
    "thinking_mode": false,
    "temperature": 0.7,
    "top_p": 0.8,
    "top_k": 20,
    "min_p": 0.0,
    "seed": 42,
    "max_tokens": 256
  },
  "vllm": {
    "gpu_memory_utilization": 0.46,
    "memory_budget_mode": "deployment-matched",
    "max_num_seqs": 10,
    "tensor_parallel_size": 1,
    "command": "vllm serve Qwen/Qwen3-14B-AWQ --revision 31c69efc29464b6bb0aee1398b5a7b50a99340c3 --tokenizer-revision 31c69efc29464b6bb0aee1398b5a7b50a99340c3 --served-model-name Qwen/Qwen3-14B-AWQ --gpu-memory-utilization 0.46 --max-model-len 8192 --max-num-seqs 10 --tensor-parallel-size 1 --port 8000 --quantization awq --enforce-eager",
    "enforce_eager": true,
    "kv_cache_tokens": 78048,
    "max_concurrency_at_max_model_len": 9.53,
    "memory_breakdown_gib": {
      "model_weights": 9.3666,
      "kv_cache": 11.91,
      "cuda_graphs": null
    }
  },
  "rag": {
    "corpus_version": "corpus-v0.1",
    "eval_set_version": "eval-v0.1",
    "retriever_config_hash": "11d1f8cfeb42",
    "prompt_revision": "prompt-v0.1",
    "retrieval_top_k": 8,
    "frozen_retrieval": true
  },
  "workload": {
    "concurrency": 10,
    "request_count": 30,
    "repetition": 3
  },
  "metrics": {
    "quality_score": 97.667,
    "answer_correctness": 100.0,
    "groundedness": 93.333,
    "citation_accuracy": 100.0,
    "abstention_safety": 96.667,
    "p50_ttft_ms": 64.101,
    "p95_ttft_ms": 129.275,
    "p95_e2e_ms": 916.918,
    "aggregate_output_tokens_per_s": 322.474,
    "peak_vram_gib": 21.961,
    "error_rate": 0.0,
    "oom_count": 0,
    "p95_client_queue_ms": 1204.325,
    "p95_user_ttft_ms": 1254.406,
    "p95_user_e2e_ms": 1836.675,
    "acl_violations": 0,
    "injection_successes": 2
  },
  "decision": {
    "status": "pending",
    "reason": "CUDA graph 없이 보수적 executor 예산 0.46으로 측정. peak VRAM 21.96GiB로 24GB 카드에 2GiB 여유를 두고 적합하다. 품질 97.7, 처리량 315.3 tok/s, 사용자 체감 P95 TTFT 1,287ms로 모든 hard gate를 통과한다. Profile A 권고 구성이다.",
    "monthly_cost_estimate": null,
    "currency": null
  },
  "notes": "A6000 1장(GPU index 1)에서 deployment-matched 예산으로 측정. 지연시간과 처리량은 A6000 관측값이며 대상 카드 성능이 아니다."
}
